{
  "strategy_type": "TechnicalSignal",
  "signal_type": "TS-004",
  "openingRangeBars": 5,
  "useAtrStop": false,
  "atrWindow": 14,
  "orderQuantity": 103,
  "contract": {
    "symbol": "BRK.B",
    "secType": "STOCK",
    "currency": "USD",
    "exchange": "IBKR"
  },
  "price_contract": {
    "symbol": "BRK.B",
    "secType": "STOCK",
    "currency": "USD",
    "exchange": "IBKR"
  },
  "ledgerPath": "data/TraderLedger/TS004_BRK_B_WEEKLY_IBKR",
  "ledgerContextCollection": "TS004_BRK_B_WEEKLY_IBKR_context"
}
