{
  "strategy_type": "TechnicalSignal",
  "signal_type": "TS-003",
  "middleWindow": 10,
  "trendWindow": 20,
  "bandStddev": 1.0,
  "orderQuantity": 416,
  "contract": {
    "symbol": "WMT",
    "secType": "STOCK",
    "currency": "USD",
    "exchange": "IBKR"
  },
  "price_contract": {
    "symbol": "WMT",
    "secType": "STOCK",
    "currency": "USD",
    "exchange": "IBKR"
  },
  "ledgerPath": "data/TraderLedger/TS003_WMT_WEEKLY_IBKR",
  "ledgerContextCollection": "TS003_WMT_WEEKLY_IBKR_context"
}
