{
  "strategy_type": "TechnicalSignal",
  "signal_type": "TS-005",
  "rsiPeriod": 7,
  "divergenceLookback": 5,
  "orderQuantity": 162,
  "contract": {
    "symbol": "AAPL",
    "secType": "STOCK",
    "currency": "USD",
    "exchange": "IBKR"
  },
  "price_contract": {
    "symbol": "AAPL",
    "secType": "STOCK",
    "currency": "USD",
    "exchange": "IBKR"
  },
  "ledgerPath": "data/TraderLedger/TS005_AAPL_WEEKLY_IBKR",
  "ledgerContextCollection": "TS005_AAPL_WEEKLY_IBKR_context"
}
