{
  "strategy_type": "TechnicalSignal",
  "signal_type": "TS-002",
  "fastWindow": 3,
  "slowWindow": 9,
  "orderQuantity": 47,
  "contract": {
    "symbol": "LLY",
    "secType": "STOCK",
    "currency": "USD",
    "exchange": "IBKR"
  },
  "price_contract": {
    "symbol": "LLY",
    "secType": "STOCK",
    "currency": "USD",
    "exchange": "IBKR"
  },
  "ledgerPath": "data/TraderLedger/TS002_LLY_WEEKLY_IBKR",
  "ledgerContextCollection": "TS002_LLY_WEEKLY_IBKR_context"
}
