{
  "strategy_type": "TechnicalSignal",
  "signal_type": "TS-005",
  "rsiPeriod": 7,
  "divergenceLookback": 5,
  "orderQuantity": 103,
  "contract": {
    "symbol": "BRK.B",
    "secType": "STOCK",
    "currency": "USD",
    "exchange": "IBKR"
  },
  "price_contract": {
    "symbol": "BRK.B",
    "secType": "STOCK",
    "currency": "USD",
    "exchange": "IBKR"
  },
  "ledgerPath": "data/TraderLedger/TS005_BRK_B_WEEKLY_IBKR",
  "ledgerContextCollection": "TS005_BRK_B_WEEKLY_IBKR_context"
}
