{
  "strategy_type": "TechnicalSignal",
  "signal_type": "TS-002",
  "fastWindow": 3,
  "slowWindow": 9,
  "orderQuantity": 163,
  "contract": {
    "symbol": "JPM",
    "secType": "STOCK",
    "currency": "USD",
    "exchange": "IBKR"
  },
  "price_contract": {
    "symbol": "JPM",
    "secType": "STOCK",
    "currency": "USD",
    "exchange": "IBKR"
  },
  "ledgerPath": "data/TraderLedger/TS002_JPM_WEEKLY_IBKR",
  "ledgerContextCollection": "TS002_JPM_WEEKLY_IBKR_context"
}
