{
  "strategy_type": "TechnicalSignal",
  "signal_type": "TS-005",
  "rsiPeriod": 7,
  "divergenceLookback": 5,
  "orderQuantity": 82,
  "contract": {
    "symbol": "META",
    "secType": "STOCK",
    "currency": "USD",
    "exchange": "IBKR"
  },
  "price_contract": {
    "symbol": "META",
    "secType": "STOCK",
    "currency": "USD",
    "exchange": "IBKR"
  },
  "ledgerPath": "data/TraderLedger/TS005_META_WEEKLY_IBKR",
  "ledgerContextCollection": "TS005_META_WEEKLY_IBKR_context"
}
