{
  "strategy_type": "TechnicalSignal",
  "signal_type": "TS-004",
  "openingRangeBars": 5,
  "useAtrStop": false,
  "atrWindow": 14,
  "orderQuantity": 82,
  "contract": {
    "symbol": "META",
    "secType": "STOCK",
    "currency": "USD",
    "exchange": "IBKR"
  },
  "price_contract": {
    "symbol": "META",
    "secType": "STOCK",
    "currency": "USD",
    "exchange": "IBKR"
  },
  "ledgerPath": "data/TraderLedger/TS004_META_WEEKLY_IBKR",
  "ledgerContextCollection": "TS004_META_WEEKLY_IBKR_context"
}
